{
  "id": "fieldwright",
  "name": "Fieldwright",
  "description": "Tinkerer and battlefield engineer. Deploys automated sentries, repairs allies, and manipulates the field with charged contraptions.",
  "baseStats": {
    "strength": 3,
    "dexterity": 4,
    "constitution": 5,
    "intelligence": 6,
    "willpower": 3
  },
  "abilities": [
    {
      "id": "wrench_strike",
      "name": "Wrench Strike",
      "cost": {
        "type": "none"
      },
      "effect": {
        "type": "damage",
        "value": "1d6+PWR",
        "range": "melee"
      },
      "tags": [
        "physical",
        "melee"
      ]
    },
    {
      "id": "deploy_sentry",
      "name": "Deploy Sentry",
      "cost": {
        "type": "engine_charge",
        "amount": 1
      },
      "effect": {
        "type": "summon",
        "unit": "sentry_turret",
        "duration": 3
      },
      "tags": [
        "summon",
        "deployable"
      ],
      "requiredRow": "back"
    },
    {
      "id": "overcharge",
      "name": "Overcharge",
      "cost": {
        "type": "engine_charge",
        "amount": 1
      },
      "effect": {
        "type": "buff",
        "stat": "power",
        "value": 3,
        "duration": 2,
        "target": "ally"
      },
      "tags": [
        "buff",
        "support"
      ]
    },
    {
      "id": "repair_pulse",
      "name": "Repair Pulse",
      "cost": {
        "type": "engine_charge",
        "amount": 1
      },
      "effect": {
        "type": "heal",
        "value": "1d6+INT",
        "target": "ally"
      },
      "tags": [
        "heal",
        "support"
      ]
    },
    {
      "id": "barricade",
      "name": "Barricade",
      "cost": {
        "type": "engine_charge",
        "amount": 2
      },
      "effect": {
        "type": "summon",
        "unit": "scrap_barricade",
        "duration": 3
      },
      "tags": [
        "summon",
        "defense"
      ],
      "requiredRow": "back"
    },
    {
      "id": "coil_overload",
      "name": "Coil Overload",
      "cost": {
        "type": "engine_charge",
        "amount": 2
      },
      "effect": {
        "type": "damage",
        "value": "1d8+INT",
        "range": "short",
        "extra": "area"
      },
      "tags": [
        "area",
        "lightning"
      ],
      "requiredRow": "back",
      "rowChangeCost": "action"
    },
    {
      "id": "war_engine",
      "name": "War Engine",
      "cost": {
        "type": "engine_charge",
        "amount": 2
      },
      "effect": {
        "type": "summon",
        "unit": "war_engine",
        "duration": 3
      },
      "tags": [
        "summon",
        "deployable"
      ],
      "branch": "artificer"
    },
    {
      "id": "demolition_charge",
      "name": "Demolition Charge",
      "cost": {
        "type": "engine_charge",
        "amount": 2
      },
      "effect": {
        "type": "damage",
        "value": "2d6+INT",
        "range": "short",
        "extra": "area"
      },
      "tags": [
        "area",
        "explosive"
      ],
      "branch": "sapper"
    },
    {
      "id": "siege_engine",
      "name": "Siege Engine",
      "cost": {
        "type": "engine_charge",
        "amount": 3
      },
      "effect": {
        "type": "summon",
        "unit": "siege_engine",
        "duration": 4
      },
      "tags": [
        "summon",
        "deployable"
      ],
      "branch": "grand_artificer"
    },
    {
      "id": "sentry_swarm",
      "name": "Sentry Swarm",
      "cost": {
        "type": "engine_charge",
        "amount": 3
      },
      "effect": {
        "type": "summon",
        "unit": "sentry_swarm",
        "duration": 3
      },
      "tags": [
        "summon",
        "deployable"
      ],
      "branch": "master_mechanic"
    },
    {
      "id": "fuel_air_bomb",
      "name": "Fuel-Air Bomb",
      "cost": {
        "type": "engine_charge",
        "amount": 3
      },
      "effect": {
        "type": "damage",
        "value": "3d6+INT",
        "range": "short",
        "extra": "area"
      },
      "tags": [
        "area",
        "explosive"
      ],
      "branch": "demolitionist"
    },
    {
      "id": "chain_lightning",
      "name": "Chain Lightning",
      "cost": {
        "type": "engine_charge",
        "amount": 3
      },
      "effect": {
        "type": "damage",
        "value": "2d8+INT",
        "range": "long",
        "extra": "area"
      },
      "tags": [
        "area",
        "lightning"
      ],
      "branch": "stormwright"
    }
  ],
  "availableBranches": [
    "artificer",
    "sapper"
  ],
  "branches": [
    {
      "id": "grand_artificer",
      "requiresBranch": "artificer",
      "factionGate": {
        "factionId": "bureau",
        "threshold": 30
      },
      "fallbackBranch": "master_mechanic"
    },
    {
      "id": "master_mechanic",
      "requiresBranch": "artificer"
    },
    {
      "id": "demolitionist",
      "requiresBranch": "sapper"
    },
    {
      "id": "stormwright",
      "requiresBranch": "sapper"
    }
  ],
  "levelTable": [
    {
      "level": 1,
      "hpGain": 0,
      "statGain": {
        "strength": 0,
        "dexterity": 0,
        "constitution": 0,
        "intelligence": 0,
        "willpower": 0
      },
      "newAbilities": [
        "wrench_strike",
        "deploy_sentry"
      ]
    },
    {
      "level": 2,
      "hpGain": 3,
      "statGain": {
        "strength": 0,
        "dexterity": 0,
        "constitution": 1,
        "intelligence": 1,
        "willpower": 0
      },
      "newAbilities": [
        "overcharge"
      ]
    },
    {
      "level": 3,
      "hpGain": 3,
      "statGain": {
        "strength": 0,
        "dexterity": 1,
        "constitution": 0,
        "intelligence": 1,
        "willpower": 0
      },
      "newAbilities": [
        "repair_pulse"
      ]
    },
    {
      "level": 4,
      "hpGain": 3,
      "statGain": {
        "strength": 0,
        "dexterity": 0,
        "constitution": 1,
        "intelligence": 0,
        "willpower": 1
      },
      "newAbilities": [
        "barricade"
      ]
    },
    {
      "level": 5,
      "hpGain": 4,
      "statGain": {
        "strength": 0,
        "dexterity": 0,
        "constitution": 0,
        "intelligence": 1,
        "willpower": 1
      },
      "newAbilities": [
        "coil_overload"
      ]
    },
    {
      "level": 6,
      "hpGain": 3,
      "statGain": {
        "strength": 0,
        "dexterity": 0,
        "constitution": 0,
        "intelligence": 1,
        "willpower": 0
      },
      "newAbilities": []
    },
    {
      "level": 7,
      "hpGain": 3,
      "statGain": {
        "strength": 0,
        "dexterity": 0,
        "constitution": 1,
        "intelligence": 0,
        "willpower": 1
      },
      "newAbilities": []
    },
    {
      "level": 8,
      "hpGain": 4,
      "statGain": {
        "strength": 0,
        "dexterity": 0,
        "constitution": 0,
        "intelligence": 1,
        "willpower": 0
      },
      "newAbilities": []
    },
    {
      "level": 9,
      "hpGain": 3,
      "statGain": {
        "strength": 0,
        "dexterity": 0,
        "constitution": 1,
        "intelligence": 0,
        "willpower": 0
      },
      "newAbilities": []
    },
    {
      "level": 10,
      "hpGain": 5,
      "statGain": {
        "strength": 0,
        "dexterity": 0,
        "constitution": 0,
        "intelligence": 1,
        "willpower": 1
      },
      "newAbilities": []
    }
  ]
}
