{
  "id": "marcher",
  "name": "Marcher",
  "description": "Pathfinder and skirmisher who excels at ranged combat and overland travel. Uses a quiver of specialized arrows and adapts quickly to changing terrain.",
  "baseStats": {
    "strength": 3,
    "dexterity": 6,
    "constitution": 3,
    "intelligence": 4,
    "willpower": 5
  },
  "abilities": [
    {
      "id": "skirmish",
      "name": "Skirmish",
      "cost": {
        "type": "none"
      },
      "effect": {
        "type": "damage",
        "value": "1d6+PWR",
        "range": "melee"
      },
      "tags": [
        "physical",
        "melee"
      ]
    },
    {
      "id": "volley",
      "name": "Volley",
      "cost": {
        "type": "quiver",
        "amount": 1
      },
      "effect": {
        "type": "damage",
        "value": "1d6+DEX",
        "range": "long"
      },
      "tags": [
        "physical",
        "projectile"
      ],
      "requiredRow": "back"
    },
    {
      "id": "travel_bonus",
      "name": "Pathfinder's Eye",
      "cost": {
        "type": "none"
      },
      "effect": {
        "type": "travel_bonus",
        "value": "-1"
      },
      "tags": [
        "travel",
        "pathfinder"
      ]
    },
    {
      "id": "tracking",
      "name": "Tracking",
      "cost": {
        "type": "quiver",
        "amount": 1
      },
      "effect": {
        "type": "reveal",
        "target": "enemy_group"
      },
      "tags": [
        "tracking",
        "pathfinder"
      ],
      "requiredRow": "back"
    },
    {
      "id": "called_shot",
      "name": "Called Shot",
      "cost": {
        "type": "quiver",
        "amount": 2
      },
      "effect": {
        "type": "damage",
        "value": "1d8+DEX",
        "range": "long"
      },
      "tags": [
        "physical",
        "projectile",
        "precision"
      ],
      "requiredRow": "back"
    },
    {
      "id": "terrain_adaptation",
      "name": "Terrain Adaptation",
      "cost": {
        "type": "none"
      },
      "effect": {
        "type": "buff",
        "stat": "evade",
        "value": 4,
        "duration": 2,
        "target": "self"
      },
      "tags": [
        "buff",
        "defense",
        "pathfinder"
      ]
    },
    {
      "id": "deadeye",
      "name": "Deadeye",
      "cost": {
        "type": "quiver",
        "amount": 2
      },
      "effect": {
        "type": "damage",
        "value": "2d8+DEX",
        "range": "long"
      },
      "tags": [
        "physical",
        "projectile",
        "precision"
      ],
      "branch": "sharpshooter"
    },
    {
      "id": "snare_trap",
      "name": "Snare Trap",
      "cost": {
        "type": "quiver",
        "amount": 1
      },
      "effect": {
        "type": "debuff",
        "stat": "evade",
        "value": -5,
        "duration": 2,
        "target": "enemy_group"
      },
      "tags": [
        "tracking",
        "debuff"
      ],
      "branch": "trapper"
    },
    {
      "id": "piercing_shot",
      "name": "Piercing Shot",
      "cost": {
        "type": "quiver",
        "amount": 3
      },
      "effect": {
        "type": "damage",
        "value": "3d8+DEX",
        "range": "long"
      },
      "tags": [
        "physical",
        "projectile",
        "precision"
      ],
      "branch": "master_archer"
    },
    {
      "id": "hunters_mark",
      "name": "Hunter's Mark",
      "cost": {
        "type": "quiver",
        "amount": 2
      },
      "effect": {
        "type": "debuff",
        "stat": "evade",
        "value": -6,
        "duration": 3,
        "target": "enemy_group"
      },
      "tags": [
        "tracking",
        "precision",
        "debuff"
      ],
      "branch": "pathwarden"
    },
    {
      "id": "pack_call",
      "name": "Pack Call",
      "cost": {
        "type": "quiver",
        "amount": 2
      },
      "effect": {
        "type": "summon",
        "unit": "hunting_beast",
        "duration": 3
      },
      "tags": [
        "summon",
        "tracking"
      ],
      "branch": "beastmaster"
    },
    {
      "id": "caltrop_field",
      "name": "Caltrop Field",
      "cost": {
        "type": "quiver",
        "amount": 2
      },
      "effect": {
        "type": "debuff",
        "stat": "speed",
        "value": -5,
        "duration": 3,
        "target": "enemy_group"
      },
      "tags": [
        "tracking",
        "debuff",
        "area"
      ],
      "branch": "saboteur"
    }
  ],
  "availableBranches": [
    "sharpshooter",
    "trapper"
  ],
  "branches": [
    {
      "id": "master_archer",
      "requiresBranch": "sharpshooter"
    },
    {
      "id": "pathwarden",
      "requiresBranch": "sharpshooter",
      "factionGate": {
        "factionId": "cartography",
        "threshold": 30
      },
      "fallbackBranch": "master_archer"
    },
    {
      "id": "beastmaster",
      "requiresBranch": "trapper"
    },
    {
      "id": "saboteur",
      "requiresBranch": "trapper"
    }
  ],
  "levelTable": [
    {
      "level": 1,
      "hpGain": 0,
      "statGain": {
        "strength": 0,
        "dexterity": 0,
        "constitution": 0,
        "intelligence": 0,
        "willpower": 0
      },
      "newAbilities": [
        "skirmish",
        "volley"
      ]
    },
    {
      "level": 2,
      "hpGain": 3,
      "statGain": {
        "strength": 0,
        "dexterity": 1,
        "constitution": 0,
        "intelligence": 0,
        "willpower": 0
      },
      "newAbilities": [
        "travel_bonus"
      ]
    },
    {
      "level": 3,
      "hpGain": 3,
      "statGain": {
        "strength": 0,
        "dexterity": 0,
        "constitution": 1,
        "intelligence": 0,
        "willpower": 0
      },
      "newAbilities": [
        "tracking"
      ]
    },
    {
      "level": 4,
      "hpGain": 3,
      "statGain": {
        "strength": 0,
        "dexterity": 1,
        "constitution": 0,
        "intelligence": 0,
        "willpower": 1
      },
      "newAbilities": [
        "called_shot"
      ]
    },
    {
      "level": 5,
      "hpGain": 4,
      "statGain": {
        "strength": 0,
        "dexterity": 0,
        "constitution": 0,
        "intelligence": 1,
        "willpower": 0
      },
      "newAbilities": [
        "terrain_adaptation"
      ]
    },
    {
      "level": 6,
      "hpGain": 3,
      "statGain": {
        "strength": 0,
        "dexterity": 1,
        "constitution": 0,
        "intelligence": 0,
        "willpower": 0
      },
      "newAbilities": []
    },
    {
      "level": 7,
      "hpGain": 3,
      "statGain": {
        "strength": 0,
        "dexterity": 0,
        "constitution": 1,
        "intelligence": 0,
        "willpower": 1
      },
      "newAbilities": []
    },
    {
      "level": 8,
      "hpGain": 4,
      "statGain": {
        "strength": 0,
        "dexterity": 1,
        "constitution": 0,
        "intelligence": 0,
        "willpower": 0
      },
      "newAbilities": []
    },
    {
      "level": 9,
      "hpGain": 3,
      "statGain": {
        "strength": 0,
        "dexterity": 0,
        "constitution": 1,
        "intelligence": 0,
        "willpower": 1
      },
      "newAbilities": []
    },
    {
      "level": 10,
      "hpGain": 5,
      "statGain": {
        "strength": 0,
        "dexterity": 1,
        "constitution": 0,
        "intelligence": 1,
        "willpower": 0
      },
      "newAbilities": []
    }
  ]
}
