{
  "id": "hollow",
  "name": "Hollow",
  "description": "Rogue and saboteur. Excels at stealth, dirty fighting, and manipulating towns through rumor and theft.",
  "baseStats": {
    "strength": 4,
    "dexterity": 6,
    "constitution": 3,
    "intelligence": 4,
    "willpower": 4
  },
  "abilities": [
    {
      "id": "shiv",
      "name": "Shiv",
      "cost": {
        "type": "none"
      },
      "effect": {
        "type": "damage",
        "value": "1d6+DEX",
        "range": "melee"
      },
      "tags": [
        "physical",
        "stealth"
      ]
    },
    {
      "id": "smoke_bomb",
      "name": "Smoke Bomb",
      "cost": {
        "type": "none"
      },
      "effect": {
        "type": "debuff",
        "stat": "accuracy",
        "value": -3,
        "duration": 2,
        "target": "enemy_group"
      },
      "tags": [
        "item",
        "blind"
      ]
    },
    {
      "id": "backstab",
      "name": "Backstab",
      "cost": {
        "type": "none"
      },
      "effect": {
        "type": "damage",
        "value": "2d6+DEX",
        "range": "melee",
        "condition": "target_status_bleed"
      },
      "tags": [
        "physical",
        "assassination"
      ]
    },
    {
      "id": "filch",
      "name": "Filch",
      "cost": {
        "type": "none"
      },
      "effect": {
        "type": "steal",
        "target": "enemy",
        "item_chance": 0.3
      },
      "tags": [
        "stealth",
        "loot"
      ]
    },
    {
      "id": "exsanguinate",
      "name": "Exsanguinate",
      "cost": {
        "type": "none"
      },
      "effect": {
        "type": "damage",
        "value": "2d8+DEX",
        "range": "melee",
        "condition": "target_status_bleed"
      },
      "tags": [
        "physical",
        "assassination"
      ],
      "branch": "cutthroat"
    },
    {
      "id": "vanish",
      "name": "Vanish",
      "cost": {
        "type": "none"
      },
      "effect": {
        "type": "buff",
        "stat": "evade",
        "value": 6,
        "duration": 2,
        "target": "self"
      },
      "tags": [
        "stealth",
        "buff"
      ],
      "branch": "nightveil"
    },
    {
      "id": "heartseeker",
      "name": "Heartseeker",
      "cost": {
        "type": "none"
      },
      "effect": {
        "type": "damage",
        "value": "3d8+DEX",
        "range": "melee",
        "condition": "target_status_bleed"
      },
      "tags": [
        "physical",
        "assassination"
      ],
      "branch": "deathdealer"
    },
    {
      "id": "lethal_dose",
      "name": "Lethal Dose",
      "cost": {
        "type": "none"
      },
      "effect": {
        "type": "damage",
        "value": "2d6+DEX",
        "range": "melee",
        "extra": "apply_poison"
      },
      "tags": [
        "physical",
        "poison"
      ],
      "branch": "poisoner"
    },
    {
      "id": "shadowstep",
      "name": "Shadowstep",
      "cost": {
        "type": "none"
      },
      "effect": {
        "type": "buff",
        "stat": "evade",
        "value": 8,
        "duration": 2,
        "target": "self"
      },
      "tags": [
        "stealth",
        "buff"
      ],
      "branch": "phantom"
    },
    {
      "id": "sabotage",
      "name": "Sabotage",
      "cost": {
        "type": "none"
      },
      "effect": {
        "type": "debuff",
        "stat": "accuracy",
        "value": -5,
        "duration": 3,
        "target": "enemy_group"
      },
      "tags": [
        "stealth",
        "debuff"
      ],
      "branch": "spymaster"
    }
  ],
  "availableBranches": [
    "cutthroat",
    "nightveil"
  ],
  "branches": [
    {
      "id": "deathdealer",
      "requiresBranch": "cutthroat"
    },
    {
      "id": "poisoner",
      "requiresBranch": "cutthroat"
    },
    {
      "id": "phantom",
      "requiresBranch": "nightveil"
    },
    {
      "id": "spymaster",
      "requiresBranch": "nightveil",
      "factionGate": {
        "factionId": "convocation",
        "threshold": 30
      },
      "fallbackBranch": "phantom"
    }
  ],
  "levelTable": [
    {
      "level": 1,
      "hpGain": 0,
      "statGain": {
        "strength": 0,
        "dexterity": 0,
        "constitution": 0,
        "intelligence": 0,
        "willpower": 0
      },
      "newAbilities": [
        "shiv",
        "smoke_bomb"
      ]
    },
    {
      "level": 2,
      "hpGain": 2,
      "statGain": {
        "strength": 0,
        "dexterity": 1,
        "constitution": 0,
        "intelligence": 0,
        "willpower": 1
      },
      "newAbilities": [
        "backstab"
      ]
    },
    {
      "level": 3,
      "hpGain": 2,
      "statGain": {
        "strength": 1,
        "dexterity": 1,
        "constitution": 0,
        "intelligence": 0,
        "willpower": 0
      },
      "newAbilities": []
    },
    {
      "level": 4,
      "hpGain": 3,
      "statGain": {
        "strength": 0,
        "dexterity": 1,
        "constitution": 1,
        "intelligence": 0,
        "willpower": 0
      },
      "newAbilities": [
        "filch"
      ]
    },
    {
      "level": 5,
      "hpGain": 3,
      "statGain": {
        "strength": 0,
        "dexterity": 1,
        "constitution": 0,
        "intelligence": 1,
        "willpower": 0
      },
      "newAbilities": []
    },
    {
      "level": 6,
      "hpGain": 3,
      "statGain": {
        "strength": 0,
        "dexterity": 1,
        "constitution": 0,
        "intelligence": 0,
        "willpower": 0
      },
      "newAbilities": []
    },
    {
      "level": 7,
      "hpGain": 3,
      "statGain": {
        "strength": 1,
        "dexterity": 0,
        "constitution": 0,
        "intelligence": 0,
        "willpower": 0
      },
      "newAbilities": []
    },
    {
      "level": 8,
      "hpGain": 4,
      "statGain": {
        "strength": 0,
        "dexterity": 1,
        "constitution": 0,
        "intelligence": 0,
        "willpower": 0
      },
      "newAbilities": []
    },
    {
      "level": 9,
      "hpGain": 3,
      "statGain": {
        "strength": 0,
        "dexterity": 0,
        "constitution": 0,
        "intelligence": 1,
        "willpower": 0
      },
      "newAbilities": []
    },
    {
      "level": 10,
      "hpGain": 5,
      "statGain": {
        "strength": 0,
        "dexterity": 1,
        "constitution": 0,
        "intelligence": 0,
        "willpower": 1
      },
      "newAbilities": []
    }
  ]
}
