{
  "id": "cauterist",
  "name": "Cauterist",
  "description": "Combat medic wielding fire-based purification. Heals allies and scorches bloom-tainted enemies.",
  "baseStats": {
    "strength": 3,
    "dexterity": 5,
    "constitution": 4,
    "intelligence": 5,
    "willpower": 4
  },
  "abilities": [
    {
      "id": "cauterize",
      "name": "Cauterize",
      "cost": {
        "type": "cautery_supply",
        "amount": 1
      },
      "effect": {
        "type": "heal",
        "value": "1d6+INT",
        "target": "ally",
        "remove_status": [
          "bleed",
          "poison"
        ]
      },
      "tags": [
        "heal",
        "fire"
      ]
    },
    {
      "id": "scalpel_dance",
      "name": "Scalpel Dance",
      "cost": {
        "type": "none"
      },
      "effect": {
        "type": "damage",
        "value": "1d6+DEX",
        "range": "melee",
        "hits": 2
      },
      "tags": [
        "physical",
        "swift"
      ]
    },
    {
      "id": "purifying_flame",
      "name": "Purifying Flame",
      "cost": {
        "type": "cautery_supply",
        "amount": 2
      },
      "effect": {
        "type": "damage",
        "value": "1d8+INT",
        "range": "short",
        "extra": "bonus_vs_bloom"
      },
      "tags": [
        "fire",
        "area"
      ]
    },
    {
      "id": "stabilize",
      "name": "Stabilize",
      "cost": {
        "type": "cautery_supply",
        "amount": 1
      },
      "effect": {
        "type": "stabilize",
        "target": "downed_ally"
      },
      "tags": [
        "heal",
        "emergency"
      ]
    },
    {
      "id": "triage",
      "name": "Triage",
      "cost": {
        "type": "cautery_supply",
        "amount": 2
      },
      "effect": {
        "type": "heal",
        "value": "1d6+INT",
        "target": "ally_group",
        "remove_status": [
          "bleed",
          "poison"
        ]
      },
      "tags": [
        "heal",
        "support"
      ],
      "branch": "field_surgeon"
    },
    {
      "id": "immolation",
      "name": "Immolation",
      "cost": {
        "type": "cautery_supply",
        "amount": 2
      },
      "effect": {
        "type": "damage",
        "value": "1d10+INT",
        "range": "short",
        "extra": "bonus_vs_bloom"
      },
      "tags": [
        "fire",
        "area"
      ],
      "branch": "pyrecaller"
    },
    {
      "id": "mass_revival",
      "name": "Mass Revival",
      "cost": {
        "type": "cautery_supply",
        "amount": 3
      },
      "effect": {
        "type": "heal",
        "value": "2d8+INT",
        "target": "ally_group"
      },
      "tags": [
        "heal",
        "emergency"
      ],
      "branch": "chief_surgeon"
    },
    {
      "id": "sterilize",
      "name": "Sterilize",
      "cost": {
        "type": "cautery_supply",
        "amount": 3
      },
      "effect": {
        "type": "heal",
        "value": "1d8+INT",
        "target": "ally_group",
        "remove_status": [
          "bleed",
          "poison",
          "bloom"
        ]
      },
      "tags": [
        "heal",
        "fire"
      ],
      "branch": "plaguebreaker"
    },
    {
      "id": "firestorm",
      "name": "Firestorm",
      "cost": {
        "type": "cautery_supply",
        "amount": 3
      },
      "effect": {
        "type": "damage",
        "value": "2d8+INT",
        "range": "short",
        "extra": "area"
      },
      "tags": [
        "fire",
        "area"
      ],
      "branch": "inferno_priest"
    },
    {
      "id": "cremate",
      "name": "Cremate",
      "cost": {
        "type": "cautery_supply",
        "amount": 3
      },
      "effect": {
        "type": "damage",
        "value": "3d6+INT",
        "range": "short",
        "extra": "bonus_vs_bloom"
      },
      "tags": [
        "fire",
        "burst"
      ],
      "branch": "ashbringer"
    }
  ],
  "availableBranches": [
    "field_surgeon",
    "pyrecaller"
  ],
  "branches": [
    {
      "id": "chief_surgeon",
      "requiresBranch": "field_surgeon"
    },
    {
      "id": "plaguebreaker",
      "requiresBranch": "field_surgeon",
      "factionGate": {
        "factionId": "bureau",
        "threshold": 30
      },
      "fallbackBranch": "chief_surgeon"
    },
    {
      "id": "inferno_priest",
      "requiresBranch": "pyrecaller"
    },
    {
      "id": "ashbringer",
      "requiresBranch": "pyrecaller"
    }
  ],
  "levelTable": [
    {
      "level": 1,
      "hpGain": 0,
      "statGain": {
        "strength": 0,
        "dexterity": 0,
        "constitution": 0,
        "intelligence": 0,
        "willpower": 0
      },
      "newAbilities": [
        "cauterize",
        "scalpel_dance"
      ]
    },
    {
      "level": 2,
      "hpGain": 3,
      "statGain": {
        "strength": 0,
        "dexterity": 0,
        "constitution": 1,
        "intelligence": 1,
        "willpower": 0
      },
      "newAbilities": [
        "purifying_flame"
      ]
    },
    {
      "level": 3,
      "hpGain": 3,
      "statGain": {
        "strength": 0,
        "dexterity": 1,
        "constitution": 0,
        "intelligence": 1,
        "willpower": 0
      },
      "newAbilities": []
    },
    {
      "level": 4,
      "hpGain": 3,
      "statGain": {
        "strength": 0,
        "dexterity": 0,
        "constitution": 1,
        "intelligence": 0,
        "willpower": 1
      },
      "newAbilities": [
        "stabilize"
      ]
    },
    {
      "level": 5,
      "hpGain": 4,
      "statGain": {
        "strength": 0,
        "dexterity": 1,
        "constitution": 0,
        "intelligence": 1,
        "willpower": 0
      },
      "newAbilities": []
    },
    {
      "level": 6,
      "hpGain": 3,
      "statGain": {
        "strength": 0,
        "dexterity": 1,
        "constitution": 0,
        "intelligence": 0,
        "willpower": 0
      },
      "newAbilities": []
    },
    {
      "level": 7,
      "hpGain": 3,
      "statGain": {
        "strength": 0,
        "dexterity": 0,
        "constitution": 1,
        "intelligence": 0,
        "willpower": 1
      },
      "newAbilities": []
    },
    {
      "level": 8,
      "hpGain": 4,
      "statGain": {
        "strength": 0,
        "dexterity": 1,
        "constitution": 0,
        "intelligence": 0,
        "willpower": 0
      },
      "newAbilities": []
    },
    {
      "level": 9,
      "hpGain": 3,
      "statGain": {
        "strength": 0,
        "dexterity": 0,
        "constitution": 0,
        "intelligence": 1,
        "willpower": 0
      },
      "newAbilities": []
    },
    {
      "level": 10,
      "hpGain": 5,
      "statGain": {
        "strength": 0,
        "dexterity": 1,
        "constitution": 0,
        "intelligence": 0,
        "willpower": 1
      },
      "newAbilities": []
    }
  ]
}
