{
  "id": "inkblood",
  "name": "Inkblood",
  "description": "Ritualist who inscribes glyphs in their own blood. Pays with temporary vitality to unleash potent arcane effects.",
  "baseStats": {
    "strength": 3,
    "dexterity": 4,
    "constitution": 4,
    "intelligence": 5,
    "willpower": 6
  },
  "abilities": [
    {
      "id": "ink_slash",
      "name": "Ink Slash",
      "cost": {
        "type": "none"
      },
      "effect": {
        "type": "damage",
        "value": "1d6+PWR",
        "range": "melee"
      },
      "tags": [
        "physical",
        "melee"
      ]
    },
    {
      "id": "knowledge_bolt",
      "name": "Knowledge Bolt",
      "cost": {
        "type": "ink_vial",
        "amount": 1
      },
      "effect": {
        "type": "damage",
        "value": "1d8+INT",
        "range": "long"
      },
      "tags": [
        "projectile",
        "arcane"
      ]
    },
    {
      "id": "blood_rune",
      "name": "Blood Rune",
      "cost": {
        "type": "none"
      },
      "effect": {
        "type": "buff",
        "stat": "power",
        "value": 4,
        "duration": 2,
        "target": "self"
      },
      "memoryCost": {
        "stat": "constitution",
        "amount": 2,
        "duration": 2
      },
      "tags": [
        "buff",
        "ritual"
      ]
    },
    {
      "id": "veil_of_ash",
      "name": "Veil of Ash",
      "cost": {
        "type": "none"
      },
      "effect": {
        "type": "buff",
        "stat": "evade",
        "value": 5,
        "duration": 2,
        "target": "self"
      },
      "memoryCost": {
        "stat": "intelligence",
        "amount": 2,
        "duration": 2
      },
      "tags": [
        "buff",
        "defense",
        "ritual"
      ]
    },
    {
      "id": "forbidden_glyph",
      "name": "Forbidden Glyph",
      "cost": {
        "type": "ink_vial",
        "amount": 2
      },
      "effect": {
        "type": "damage",
        "value": "2d6+INT",
        "range": "short"
      },
      "memoryCost": {
        "stat": "willpower",
        "amount": 2,
        "duration": 2
      },
      "tags": [
        "arcane",
        "burst",
        "ritual"
      ]
    },
    {
      "id": "crimson_ward",
      "name": "Crimson Ward",
      "cost": {
        "type": "ink_vial",
        "amount": 1
      },
      "effect": {
        "type": "buff",
        "stat": "maxHp",
        "value": 6,
        "duration": 3,
        "target": "self"
      },
      "memoryCost": {
        "stat": "strength",
        "amount": 2,
        "duration": 2
      },
      "tags": [
        "defense",
        "ritual"
      ]
    },
    {
      "id": "hemorrhage_glyph",
      "name": "Hemorrhage Glyph",
      "cost": {
        "type": "ink_vial",
        "amount": 2
      },
      "effect": {
        "type": "damage",
        "value": "2d8+INT",
        "range": "short"
      },
      "tags": [
        "arcane",
        "burst",
        "ritual"
      ],
      "branch": "bloodscribe"
    },
    {
      "id": "aegis_sigil",
      "name": "Aegis Sigil",
      "cost": {
        "type": "ink_vial",
        "amount": 1
      },
      "effect": {
        "type": "buff",
        "stat": "maxHp",
        "value": 8,
        "duration": 3,
        "target": "ally_group"
      },
      "tags": [
        "defense",
        "ritual"
      ],
      "branch": "wardwright"
    },
    {
      "id": "blood_nova",
      "name": "Blood Nova",
      "cost": {
        "type": "ink_vial",
        "amount": 3
      },
      "effect": {
        "type": "damage",
        "value": "3d8+INT",
        "range": "short",
        "extra": "area"
      },
      "tags": [
        "arcane",
        "burst",
        "ritual"
      ],
      "branch": "hemomancer"
    },
    {
      "id": "forbidden_sigil",
      "name": "Forbidden Sigil",
      "cost": {
        "type": "ink_vial",
        "amount": 3
      },
      "effect": {
        "type": "damage",
        "value": "2d10+INT",
        "range": "long"
      },
      "tags": [
        "arcane",
        "burst",
        "ritual"
      ],
      "branch": "glyphmaster"
    },
    {
      "id": "grand_aegis",
      "name": "Grand Aegis",
      "cost": {
        "type": "ink_vial",
        "amount": 2
      },
      "effect": {
        "type": "buff",
        "stat": "maxHp",
        "value": 12,
        "duration": 3,
        "target": "ally_group"
      },
      "tags": [
        "defense",
        "ritual"
      ],
      "branch": "wardlord"
    },
    {
      "id": "binding_circle",
      "name": "Binding Circle",
      "cost": {
        "type": "ink_vial",
        "amount": 2
      },
      "effect": {
        "type": "debuff",
        "stat": "speed",
        "value": -4,
        "duration": 2,
        "target": "enemy_group"
      },
      "tags": [
        "defense",
        "ritual",
        "debuff"
      ],
      "branch": "sigilbinder"
    }
  ],
  "availableBranches": [
    "bloodscribe",
    "wardwright"
  ],
  "branches": [
    {
      "id": "hemomancer",
      "requiresBranch": "bloodscribe",
      "factionGate": {
        "factionId": "inkblood",
        "threshold": 30
      },
      "fallbackBranch": "glyphmaster"
    },
    {
      "id": "glyphmaster",
      "requiresBranch": "bloodscribe"
    },
    {
      "id": "wardlord",
      "requiresBranch": "wardwright"
    },
    {
      "id": "sigilbinder",
      "requiresBranch": "wardwright"
    }
  ],
  "levelTable": [
    {
      "level": 1,
      "hpGain": 0,
      "statGain": {
        "strength": 0,
        "dexterity": 0,
        "constitution": 0,
        "intelligence": 0,
        "willpower": 0
      },
      "newAbilities": [
        "ink_slash",
        "knowledge_bolt"
      ]
    },
    {
      "level": 2,
      "hpGain": 3,
      "statGain": {
        "strength": 0,
        "dexterity": 0,
        "constitution": 1,
        "intelligence": 0,
        "willpower": 1
      },
      "newAbilities": [
        "blood_rune"
      ]
    },
    {
      "level": 3,
      "hpGain": 3,
      "statGain": {
        "strength": 0,
        "dexterity": 1,
        "constitution": 0,
        "intelligence": 1,
        "willpower": 0
      },
      "newAbilities": [
        "veil_of_ash"
      ]
    },
    {
      "level": 4,
      "hpGain": 3,
      "statGain": {
        "strength": 0,
        "dexterity": 0,
        "constitution": 1,
        "intelligence": 0,
        "willpower": 1
      },
      "newAbilities": [
        "forbidden_glyph"
      ]
    },
    {
      "level": 5,
      "hpGain": 4,
      "statGain": {
        "strength": 0,
        "dexterity": 0,
        "constitution": 0,
        "intelligence": 1,
        "willpower": 1
      },
      "newAbilities": [
        "crimson_ward"
      ]
    },
    {
      "level": 6,
      "hpGain": 3,
      "statGain": {
        "strength": 0,
        "dexterity": 0,
        "constitution": 0,
        "intelligence": 0,
        "willpower": 1
      },
      "newAbilities": []
    },
    {
      "level": 7,
      "hpGain": 3,
      "statGain": {
        "strength": 0,
        "dexterity": 0,
        "constitution": 1,
        "intelligence": 0,
        "willpower": 0
      },
      "newAbilities": []
    },
    {
      "level": 8,
      "hpGain": 4,
      "statGain": {
        "strength": 0,
        "dexterity": 0,
        "constitution": 0,
        "intelligence": 1,
        "willpower": 0
      },
      "newAbilities": []
    },
    {
      "level": 9,
      "hpGain": 3,
      "statGain": {
        "strength": 0,
        "dexterity": 0,
        "constitution": 0,
        "intelligence": 0,
        "willpower": 1
      },
      "newAbilities": []
    },
    {
      "level": 10,
      "hpGain": 5,
      "statGain": {
        "strength": 0,
        "dexterity": 0,
        "constitution": 0,
        "intelligence": 1,
        "willpower": 1
      },
      "newAbilities": []
    }
  ]
}
